{
  "schemaVersion": 1,
  "id": "complex-numbers-assessment",
  "title": "End of module: Complex Numbers",
  "questions": [
    {
      "id": "q1",
      "type": "mcq",
      "text": "Which of the following is the standard form of a complex number?",
      "choices": [
        "$a + bi$, where $a$ and $b$ are real numbers",
        "$a \\times b$, where $a$ and $b$ are integers",
        "$\\sqrt{a}$ for a negative number $a$",
        "$a / b$ in lowest terms"
      ],
      "answer": 0,
      "explanation": "A complex number is written $a + bi$, where $a$ is the real part and $b$ is the imaginary part (the coefficient of $i$)."
    },
    {
      "id": "q2",
      "type": "numeric",
      "text": "If $z = 4 + 3i$, what is the real part of $z$?",
      "answer": 4,
      "tolerance": 0,
      "explanation": "The real part is the term without $i$: for $z = 4 + 3i$, that is $4$."
    }
  ]
}
