{
  "schemaVersion": 1,
  "id": "neural-networks-1-perceptrons-assessment",
  "title": "End of module: Neural Networks I — Perceptrons",
  "questions": [
    {
      "id": "q1",
      "type": "numeric",
      "text": "A perceptron has weights $w_1 = 2$, $w_2 = -3$ and bias $b = 0.5$. For inputs $x_1 = 1$, $x_2 = 1$, compute the weighted sum $z = w_1 x_1 + w_2 x_2 + b$.",
      "answer": -0.5,
      "tolerance": 0.01,
      "explanation": "$z = (2)(1) + (-3)(1) + 0.5 = 2 - 3 + 0.5 = -0.5$."
    },
    {
      "id": "q2",
      "type": "numeric",
      "text": "A perceptron has weights $\\mathbf{w} = (0.5,\\ -0.5,\\ 2.0)$ and bias $b = 1$. For input $\\mathbf{x} = (2,\\ 3,\\ 1)$, compute the weighted sum $z$.",
      "answer": 2.5,
      "tolerance": 0.01,
      "explanation": "$z = (0.5)(2) + (-0.5)(3) + (2.0)(1) + 1 = 1.0 - 1.5 + 2.0 + 1 = 2.5$."
    },
    {
      "id": "q3",
      "type": "numeric",
      "text": "Evaluate the logistic sigmoid $\\sigma(0) = \\dfrac{1}{1 + e^{0}}$.",
      "answer": 0.5,
      "tolerance": 0.01,
      "explanation": "$e^{0} = 1$, so $\\sigma(0) = \\frac{1}{1+1} = \\frac{1}{2} = 0.5$. At the boundary the neuron is maximally undecided."
    },
    {
      "id": "q4",
      "type": "numeric",
      "text": "A single-input neuron has weight $w = 1$ and bias $b = 1$. For input $x = 1$, the pre-activation is $z = wx + b = 2$. Compute the sigmoid output $\\sigma(2) = \\dfrac{1}{1 + e^{-2}}$ (give 2 decimal places).",
      "answer": 0.88,
      "tolerance": 0.01,
      "explanation": "$z = (1)(1) + 1 = 2$, and $\\sigma(2) = \\frac{1}{1 + e^{-2}} \\approx \\frac{1}{1 + 0.1353} \\approx 0.88$."
    },
    {
      "id": "q5",
      "type": "numeric",
      "text": "An AND-gate perceptron uses $w_1 = w_2 = 1$ and $b = -1.5$. For the input $(x_1, x_2) = (1, 1)$, compute the weighted sum $z$.",
      "answer": 0.5,
      "tolerance": 0.01,
      "explanation": "$z = (1)(1) + (1)(1) - 1.5 = 2 - 1.5 = 0.5$. Because $z \\ge 0$ the step activation outputs $1$, which is correct since $1\\text{ AND }1 = 1$."
    },
    {
      "id": "q6",
      "type": "mcq",
      "text": "What does the activation function do in a perceptron?",
      "choices": [
        "It multiplies each input by its weight",
        "It transforms the weighted sum $z$ into the neuron's output",
        "It adds the bias to the inputs",
        "It chooses the learning rate"
      ],
      "answer": 1,
      "explanation": "The weights and bias produce the pre-activation $z$; the activation function (step or sigmoid) then maps $z$ to the neuron's output."
    },
    {
      "id": "q7",
      "type": "mcq",
      "text": "The step activation outputs $1$ exactly when…",
      "choices": [
        "$z < 0$",
        "$z = 1$",
        "$z \\ge 0$",
        "$z$ is even"
      ],
      "answer": 2,
      "explanation": "$\\text{step}(z) = 1$ for $z \\ge 0$ and $0$ for $z < 0$. The neuron fires when the weighted sum is at least zero."
    },
    {
      "id": "q8",
      "type": "mcq",
      "text": "For two inputs, the perceptron's decision boundary $w_1 x_1 + w_2 x_2 + b = 0$ is…",
      "choices": [
        "a single point",
        "a parabola",
        "a straight line",
        "a circle"
      ],
      "answer": 2,
      "explanation": "The equation is linear in $x_1$ and $x_2$, so the boundary is a straight line. The weights set its orientation and the bias sets its position."
    },
    {
      "id": "q9",
      "type": "mcq",
      "text": "In the perceptron learning rule $w_i \\leftarrow w_i + \\eta\\,(t - y)\\,x_i$, when do the weights stay unchanged?",
      "choices": [
        "When the learning rate $\\eta$ is large",
        "When the prediction is correct, so $t - y = 0$",
        "When the input $x_i$ is positive",
        "Only on the first example"
      ],
      "answer": 1,
      "explanation": "If $y = t$ then $t - y = 0$, so $\\Delta w_i = \\eta \\cdot 0 \\cdot x_i = 0$. The rule only updates weights on misclassified examples."
    },
    {
      "id": "q10",
      "type": "multi",
      "text": "Which of the following logic gates can a single perceptron learn (i.e. are linearly separable)?",
      "choices": ["AND", "OR", "XOR", "NOT"],
      "answers": [0, 1, 3],
      "explanation": "AND, OR and NOT are linearly separable, so one perceptron suffices. XOR is **not** linearly separable — no single straight line separates its outputs — which is why multi-layer networks are needed."
    },
    {
      "id": "q11",
      "type": "text",
      "text": "What is the name of the smooth, S-shaped activation function given by $\\dfrac{1}{1 + e^{-z}}$?",
      "accept": ["(the )?(logistic )?sigmoid( function)?", "(the )?logistic( function)?"],
      "caseSensitive": false,
      "explanation": "$\\sigma(z) = \\frac{1}{1+e^{-z}}$ is the **logistic sigmoid**. It squashes any real number into $(0, 1)$ and replaces the step function's cliff with a smooth ramp."
    },
    {
      "id": "q12",
      "type": "numeric",
      "text": "Using the learning rule with rate $\\eta = 0.1$, a perceptron mispredicts an example: target $t = 1$ but output $y = 0$, for input $x_1 = 1$. The update is $\\Delta w_1 = \\eta\\,(t - y)\\,x_1$. Compute $\\Delta w_1$.",
      "answer": 0.1,
      "tolerance": 0.001,
      "explanation": "$\\Delta w_1 = (0.1)(1 - 0)(1) = 0.1$. The weight increases, pushing the boundary toward correctly firing on this input."
    }
  ]
}
